{
  "$schema": "../protocol-schema.json",
  "name": "spike",
  "version": "1.0.0",
  "description": "Time-boxed technical feasibility exploration",
  "input": {
    "type": "task",
    "required": false,
    "default_for": []
  },
  "phases": [
    {
      "id": "spike",
      "name": "Spike",
      "description": "Execute the spike — research, iterate, write findings",
      "type": "once"
    }
  ],
  "signals": {
    "PHASE_COMPLETE": {
      "description": "Signal spike is complete"
    },
    "BLOCKED": {
      "description": "Signal spike is blocked",
      "requires": "reason"
    }
  },
  "defaults": {
    "mode": "soft",
    "consultation": {
      "enabled": false,
      "models": [],
      "parallel": false
    }
  }
}
